{
  "schema_version": 1,
  "skill": "control-backup",
  "status": "ADMITTED",
  "source_lock": {
    "path": "intake/control-backup/source-lock.json",
    "sha256": "faf6cefa5afbd71452e19caca63f5c3c752f6d287aa91232d35976a2b9c4d2f6"
  },
  "subject_files": [
    {
      "path": "skills/control-backup/AGENTS.md",
      "sha256": "860dde11897cc4151c54770b7fce7992ff970539292c24dad9c706f8512186de"
    },
    {
      "path": "skills/control-backup/README.md",
      "sha256": "2b4fc9c43aea8ca9ada4f3718e893d0ff64904baf5947065c7e4ca5684e6c719"
    },
    {
      "path": "skills/control-backup/SKILL.md",
      "sha256": "e60871cc66725097840f85bc8f7ed0576298b4ac23201d939ce1a0030c608c11"
    },
    {
      "path": "skills/control-backup/domain/backup-topology.json",
      "sha256": "372986cf8f8c177bf7f8929c6374d7ae8dca1558f31ac7d02ab502897e1286d0"
    },
    {
      "path": "skills/control-backup/evals/cases.json",
      "sha256": "f67d2c34ee547b37e642dedff4ab622a2d32fa658413d23003539f872f158256"
    },
    {
      "path": "skills/control-backup/receipts.json",
      "sha256": "99af86d08819a1b9fde2137dc5749c5f8588fbbd8bf638682afe4453e218341c"
    },
    {
      "path": "skills/control-backup/references/README.md",
      "sha256": "2a8bdef21a207de154174814064273f0781ba79bae140eec1af843ef3e6f586c"
    },
    {
      "path": "skills/control-backup/references/portable-backup-policy.md",
      "sha256": "1370739676dc7e801d787c36332e7aca0d4f83f8c5888cbbd3c72cdda81e9a0c"
    },
    {
      "path": "skills/control-backup/references/procedures.md",
      "sha256": "d35697fc2ae678afde2e5ab2ba5df5b97c645eb5873fb49e524ee4a40084d8a9"
    },
    {
      "path": "skills/control-backup/scripts/backup_driver.py",
      "sha256": "101a7a35d854d318059b04632c57cac48610f97f0906539ca0f871d2840f7e15"
    },
    {
      "path": "skills/control-backup/scripts/gen_admission.py",
      "sha256": "acfaa087688280e70280b2516a13eb36cdca0c25515e9ccdb91546106982f819"
    },
    {
      "path": "skills/control-backup/scripts/gen_backup_receipts.py",
      "sha256": "660b8a141ac1d7380b9065541884d68136ff3ea45618e3c57a6b841e05243df2"
    },
    {
      "path": "skills/control-backup/scripts/gen_source_lock.py",
      "sha256": "b7d5b3685289abfef6583aac1e850630d6ec16ea989c545d76e1be53b730bd22"
    },
    {
      "path": "skills/control-backup/scripts/validate_control_backup.py",
      "sha256": "fe3658f1fb48aaaf200aa05897bae881f73de0a13e54ad6579dfa177e78fb932"
    },
    {
      "path": "skills/control-backup/skill.json",
      "sha256": "088fb3f4ddfc0971b402ae26c45fa7dfc82960cff12b86202db1c5ab60abb118"
    },
    {
      "path": "skills/control-backup/tests/test_control_backup.py",
      "sha256": "990bf08232df43450837276b7199a47abb304ba0dad1dfe564481bd7efe9f287"
    }
  ],
  "skill_tree_sha256": "020d143039c2b94ba1ab48aa706f7ec8a920156d53aa5da9bcc7ef5095c9108c",
  "contract_files": [
    {
      "path": "contracts/skill-manifest.schema.json",
      "sha256": "e8a926418ceadeaee03d3a80bd8ad016e387470f42e34b173d3cad89c83cc209"
    },
    {
      "path": "contracts/source-lock.schema.json",
      "sha256": "a59e1c7701ac8e56e8c6110930b27ca269864f963f3c60d427b9f343921db5be"
    },
    {
      "path": "contracts/admission.schema.json",
      "sha256": "37de9f53d752f3e05291135f8b14dfcee03f138b263cfa1b5bcf5b8e9585be7f"
    }
  ],
  "controls": [
    {
      "id": "agents-three-document-route",
      "state": "PASS"
    },
    {
      "id": "bundle-anatomy",
      "state": "PASS"
    },
    {
      "id": "source-lock",
      "state": "PASS"
    },
    {
      "id": "executable-route",
      "state": "PASS"
    },
    {
      "id": "feature-map-positive",
      "state": "PASS"
    },
    {
      "id": "missing-terminal-oracle",
      "state": "PASS"
    },
    {
      "id": "static-only-false-proof",
      "state": "PASS"
    },
    {
      "id": "skip-without-blocker",
      "state": "PASS"
    },
    {
      "id": "changed-feature-hollow-route",
      "state": "PASS"
    },
    {
      "id": "transition-chain-mutation",
      "state": "PASS"
    },
    {
      "id": "persistence-mutation",
      "state": "PASS"
    },
    {
      "id": "admission-tree-digest",
      "state": "PASS"
    },
    {
      "id": "control-backup-positive",
      "state": "PASS"
    },
    {
      "id": "l2-driver-selftest",
      "state": "PASS"
    },
    {
      "id": "missing-layer-file",
      "state": "PASS"
    },
    {
      "id": "unbacked-receipt-removed",
      "state": "PASS"
    },
    {
      "id": "openrsync-admitted",
      "state": "PASS"
    },
    {
      "id": "driver-negative-control-defused",
      "state": "PASS"
    },
    {
      "id": "receipts-are-produced-not-typed",
      "state": "PASS"
    },
    {
      "id": "producer-for-an-absent-assertion",
      "state": "PASS"
    },
    {
      "id": "producer-for-a-red-assertion",
      "state": "PASS"
    },
    {
      "id": "producer-with-no-correspondence",
      "state": "PASS"
    },
    {
      "id": "hand-edited-receipts",
      "state": "PASS"
    }
  ],
  "evidence_ceiling": "L3_HERMETIC",
  "not_claimed": [
    "L4_MATCHED_LIVE_RUNTIME",
    "L5_DELIVERY_AND_PRODUCTION"
  ],
  "authoring_command": "python3 scripts/run_all.py",
  "hosted_evidence": "READ_FROM_GITHUB"
}
