{
  "schema_version": 1,
  "skill": "context-closure-engineering",
  "status": "ADMITTED",
  "source_lock": {
    "path": "intake/context-closure-engineering/source-lock.json",
    "sha256": "42c65e0bb8065fb1d895b74ffaa1392598620957d7738c907cb80bf3342ebd9b"
  },
  "subject_files": [
    {
      "path": "skills/context-closure-engineering/AGENTS.md",
      "sha256": "6e57e9518bd4ae116fb60f879ad11422307d25566ef8a6d96510f7a226b9dbd7"
    },
    {
      "path": "skills/context-closure-engineering/README.md",
      "sha256": "8fa517667270d5cc29322ebd602a06a6fe2340c293e0ece5eba9bf930c6ec2d7"
    },
    {
      "path": "skills/context-closure-engineering/SKILL.md",
      "sha256": "841908a4a63ccb874c860ef782c1cd6c537a6f50b52825e9c4eaf6e759737dcd"
    },
    {
      "path": "skills/context-closure-engineering/domain/context-closure-topology.json",
      "sha256": "be9b3cd8f3b741fcee2f9bc6f711baa4b663c17b5a2fe22053890e5ead4f073e"
    },
    {
      "path": "skills/context-closure-engineering/evals/cases.json",
      "sha256": "09e84186669ab1921d3609d040bb7398d0e023d03352f0ed5ec0ff1a2da64185"
    },
    {
      "path": "skills/context-closure-engineering/evals/fixtures/baseline.json",
      "sha256": "9fdd0385e644a3a48e0a698bc1884256924e49e3df65e7224417335c6221006e"
    },
    {
      "path": "skills/context-closure-engineering/evals/fixtures/pack/CLOSURE.md",
      "sha256": "4883f7ab1940f2d1ebfc99fbe467a7cffdbe1cf5eb8a40db13059e7c62c5d022"
    },
    {
      "path": "skills/context-closure-engineering/evals/fixtures/pack/DAG.md",
      "sha256": "f6935fa9da2cffa765b7fb6926980b973df1492d4da3a6518801361a747e7dcf"
    },
    {
      "path": "skills/context-closure-engineering/evals/fixtures/pack/DRIFT.md",
      "sha256": "6a3721fa0b979dd5d535a50221e77502d0d1d8cb281b9ae08232d84b9f980189"
    },
    {
      "path": "skills/context-closure-engineering/evals/fixtures/pack/README.md",
      "sha256": "5904144b315a80a17fc925bf468ab8181cf15197118d5f9254c80d3b4fcd65fb"
    },
    {
      "path": "skills/context-closure-engineering/evals/fixtures/pack/SYSTEM.md",
      "sha256": "474d6ae8188610ae8c481b0be5f0963ef6050b04998ae9c16b5e817a7d64591f"
    },
    {
      "path": "skills/context-closure-engineering/evals/fixtures/pack/TRACEABILITY.md",
      "sha256": "f0a255544d9739817dca0743921787a57757cbb2c553c8673ddc567065119cd2"
    },
    {
      "path": "skills/context-closure-engineering/references/consumer-adapter-contract.md",
      "sha256": "ac9ccaffb2a23d285d4de2ce7bae18c07977c259019b52a1c7ede248abc22f24"
    },
    {
      "path": "skills/context-closure-engineering/references/portable-context-closure-policy.md",
      "sha256": "59f422c080c162dac6800be92dbefb9a0f0a5da5c29a6f4855f11210d8a50252"
    },
    {
      "path": "skills/context-closure-engineering/scripts/check_context_pack.py",
      "sha256": "6ca053785e8f1ff9b4c3596a20e14e5eba37e1024a1f48f30c08d25173c65f4a"
    },
    {
      "path": "skills/context-closure-engineering/scripts/gen_admission.py",
      "sha256": "f32ed6bb9d773a7fb086fc6e374e0d437f82f2a0c8e890da7994c0b27a800ac8"
    },
    {
      "path": "skills/context-closure-engineering/scripts/gen_source_lock.py",
      "sha256": "d2d38e08bf7de971a4a69889caad985d1df8ddd980f9905d5d4662dab8eaa816"
    },
    {
      "path": "skills/context-closure-engineering/scripts/validate_context_closure_engineering.py",
      "sha256": "706a2032a52779e85613e6a32c8ed1db9f1f1465f885f733a83090d217e79e5d"
    },
    {
      "path": "skills/context-closure-engineering/skill.json",
      "sha256": "29656911713b24e0a80165e2a56348735e331068537527a0540aa3294942b509"
    },
    {
      "path": "skills/context-closure-engineering/tests/test_context_closure_engineering.py",
      "sha256": "9a2d446234d7a86935c9adefda8053394ac4b400956528afc4884c00f17d1e8e"
    }
  ],
  "skill_tree_sha256": "f473efe70026545c8e12f104803276e61b93ed46c289bb7f81179570842017a2",
  "contract_files": [
    {
      "path": "contracts/skill-manifest.schema.json",
      "sha256": "e8a926418ceadeaee03d3a80bd8ad016e387470f42e34b173d3cad89c83cc209"
    },
    {
      "path": "contracts/source-lock.schema.json",
      "sha256": "a59e1c7701ac8e56e8c6110930b27ca269864f963f3c60d427b9f343921db5be"
    },
    {
      "path": "contracts/admission.schema.json",
      "sha256": "37de9f53d752f3e05291135f8b14dfcee03f138b263cfa1b5bcf5b8e9585be7f"
    }
  ],
  "controls": [
    {
      "id": "agents-three-document-route",
      "state": "PASS"
    },
    {
      "id": "bundle-anatomy",
      "state": "PASS"
    },
    {
      "id": "source-lock",
      "state": "PASS"
    },
    {
      "id": "executable-route",
      "state": "PASS"
    },
    {
      "id": "feature-map-positive",
      "state": "PASS"
    },
    {
      "id": "missing-terminal-oracle",
      "state": "PASS"
    },
    {
      "id": "static-only-false-proof",
      "state": "PASS"
    },
    {
      "id": "skip-without-blocker",
      "state": "PASS"
    },
    {
      "id": "changed-feature-hollow-route",
      "state": "PASS"
    },
    {
      "id": "transition-chain-mutation",
      "state": "PASS"
    },
    {
      "id": "persistence-mutation",
      "state": "PASS"
    },
    {
      "id": "admission-tree-digest",
      "state": "PASS"
    },
    {
      "id": "context-pack-positive",
      "state": "PASS"
    },
    {
      "id": "context-pack-selftest",
      "state": "PASS"
    },
    {
      "id": "law-clause-dropped",
      "state": "PASS"
    },
    {
      "id": "negative-demoted-to-prose",
      "state": "PASS"
    },
    {
      "id": "checker-assertion-defused",
      "state": "PASS"
    },
    {
      "id": "stale-projection-discriminated",
      "state": "PASS"
    },
    {
      "id": "task-packet-unbounded",
      "state": "PASS"
    },
    {
      "id": "stage-p0-check-dead",
      "state": "PASS"
    },
    {
      "id": "consumer-canary-overclaimed",
      "state": "PASS"
    }
  ],
  "evidence_ceiling": "L3_HERMETIC",
  "not_claimed": [
    "L4_MATCHED_LIVE_RUNTIME",
    "L5_DELIVERY_AND_PRODUCTION"
  ],
  "authoring_command": "python3 scripts/run_all.py",
  "hosted_evidence": "READ_FROM_GITHUB"
}
