{
  "schema_version": 1,
  "skill": "control-code-intel",
  "status": "ADMITTED",
  "source_lock": {
    "path": "intake/control-code-intel/source-lock.json",
    "sha256": "4ea7b8415d13ac835fcb3d46e4372c368eda2f00ec57f8157c85f19bb0c85fc3"
  },
  "subject_files": [
    {
      "path": "skills/control-code-intel/AGENTS.md",
      "sha256": "a50c79e6456df79ae2b4a5a0c0e5f77eb9d82928cee8e046e70b6b1d6eb22103"
    },
    {
      "path": "skills/control-code-intel/README.md",
      "sha256": "0ed155a88fc084516add6b72bb6956d74a9cdc848d76b1d8741727b807c28a49"
    },
    {
      "path": "skills/control-code-intel/SKILL.md",
      "sha256": "f324d574fe757be9b8bee814444c89824cc1904d6254e522d96c2817994da988"
    },
    {
      "path": "skills/control-code-intel/domain/code-intel-topology.json",
      "sha256": "b0ada41497a008196b36dbd0b1203dbe3116b0be74580998ea75a21614780dc7"
    },
    {
      "path": "skills/control-code-intel/evals/cases.json",
      "sha256": "abdad79c467a15f98c22f06373e7c8083d3e9f0bf085a98c5acf961b4911e369"
    },
    {
      "path": "skills/control-code-intel/receipts.json",
      "sha256": "2f02629c84b9b65fd4a824694829a572a8fb193948e47d7260b0a54c78c712cc"
    },
    {
      "path": "skills/control-code-intel/references/README.md",
      "sha256": "bf676e7a31b152e677c37e588eeb48121217a4aa2ed5218060b6b987c57873b3"
    },
    {
      "path": "skills/control-code-intel/references/portable-code-intel-policy.md",
      "sha256": "9aa7415c15a5a417b8715c36d36d2a6e76b41e138e0488d044a24643b2b5f0d0"
    },
    {
      "path": "skills/control-code-intel/references/procedures.md",
      "sha256": "d25bc635083fa7de95816661520fc565d79ebcebb17ba977713fb99f6126eab8"
    },
    {
      "path": "skills/control-code-intel/scripts/code_intel_driver.py",
      "sha256": "fb4bcd177336526c87f2c5cfaf2ab8da43c93813daba42fac4c5e708286aec5b"
    },
    {
      "path": "skills/control-code-intel/scripts/gen_admission.py",
      "sha256": "64d9dd6d8a549bed74e389e02e6af8b0071324bbb9b4f41097d0d2fc3d090b5e"
    },
    {
      "path": "skills/control-code-intel/scripts/gen_receipts.py",
      "sha256": "f02f4c37f475424f201753b8d5cd18e5a049e6a73d12f41c5a7220dba2ad6c39"
    },
    {
      "path": "skills/control-code-intel/scripts/gen_source_lock.py",
      "sha256": "9847a83cbea05584ef4e81b4379210bb8cef345bb8f8243f6d86130ca870ee8e"
    },
    {
      "path": "skills/control-code-intel/scripts/validate_control_code_intel.py",
      "sha256": "32208e0cfc3b588aff6bcaef6e7706a9d532ccfe24fc1dd4877dd9075a2cbe34"
    },
    {
      "path": "skills/control-code-intel/skill.json",
      "sha256": "f19d0ff0be54266b2ca6ae3ba642bd42aea1b8f2108f3dae86b4756823f2e669"
    },
    {
      "path": "skills/control-code-intel/tests/test_control_code_intel.py",
      "sha256": "3f5fe7454b84ec8a93f64fea1ac4b627fa95edc3d85f8dd3f81517676adf078b"
    }
  ],
  "skill_tree_sha256": "47a88368162e0f7dfdbcd0052ca30b997eb7b21823e5689a185ab3a1cf30a2b7",
  "contract_files": [
    {
      "path": "contracts/skill-manifest.schema.json",
      "sha256": "e8a926418ceadeaee03d3a80bd8ad016e387470f42e34b173d3cad89c83cc209"
    },
    {
      "path": "contracts/source-lock.schema.json",
      "sha256": "a59e1c7701ac8e56e8c6110930b27ca269864f963f3c60d427b9f343921db5be"
    },
    {
      "path": "contracts/admission.schema.json",
      "sha256": "37de9f53d752f3e05291135f8b14dfcee03f138b263cfa1b5bcf5b8e9585be7f"
    }
  ],
  "controls": [
    {
      "id": "agents-three-document-route",
      "state": "PASS"
    },
    {
      "id": "bundle-anatomy",
      "state": "PASS"
    },
    {
      "id": "source-lock",
      "state": "PASS"
    },
    {
      "id": "executable-route",
      "state": "PASS"
    },
    {
      "id": "feature-map-positive",
      "state": "PASS"
    },
    {
      "id": "missing-terminal-oracle",
      "state": "PASS"
    },
    {
      "id": "static-only-false-proof",
      "state": "PASS"
    },
    {
      "id": "skip-without-blocker",
      "state": "PASS"
    },
    {
      "id": "changed-feature-hollow-route",
      "state": "PASS"
    },
    {
      "id": "transition-chain-mutation",
      "state": "PASS"
    },
    {
      "id": "persistence-mutation",
      "state": "PASS"
    },
    {
      "id": "admission-tree-digest",
      "state": "PASS"
    },
    {
      "id": "control-code-intel-positive",
      "state": "PASS"
    },
    {
      "id": "l2-driver-selftest",
      "state": "PASS"
    },
    {
      "id": "missing-layer-file",
      "state": "PASS"
    },
    {
      "id": "unbacked-receipt-removed",
      "state": "PASS"
    },
    {
      "id": "lancedb-admitted",
      "state": "PASS"
    },
    {
      "id": "driver-negative-control-defused",
      "state": "PASS"
    },
    {
      "id": "preflight-passes-on-a-provisioned-path",
      "state": "PASS"
    },
    {
      "id": "declared-tool-absent-from-path",
      "state": "PASS"
    },
    {
      "id": "absence-is-not-a-negative-result",
      "state": "PASS"
    },
    {
      "id": "tool-without-a-presence-declaration",
      "state": "PASS"
    },
    {
      "id": "ambient-without-a-prerequisite",
      "state": "PASS"
    },
    {
      "id": "host-absolute-path-in-tracked-bytes",
      "state": "PASS"
    },
    {
      "id": "receipts-are-produced-not-typed",
      "state": "PASS"
    },
    {
      "id": "producer-for-an-absent-assertion",
      "state": "PASS"
    },
    {
      "id": "producer-for-a-red-assertion",
      "state": "PASS"
    },
    {
      "id": "producer-with-no-correspondence",
      "state": "PASS"
    },
    {
      "id": "hand-edited-receipts",
      "state": "PASS"
    }
  ],
  "evidence_ceiling": "L3_HERMETIC",
  "not_claimed": [
    "L4_MATCHED_LIVE_RUNTIME",
    "L5_DELIVERY_AND_PRODUCTION"
  ],
  "authoring_command": "python3 scripts/run_all.py",
  "hosted_evidence": "READ_FROM_GITHUB"
}
